{
  "$schema": "https://json-schema.org/draft/2020-12/schema",
  "type": "object",
  "properties": {
    "$schema": {
      "type": "string"
    },
    "formatVersion": {
      "type": "number",
      "const": 1
    },
    "contentRevision": {
      "type": "integer",
      "exclusiveMinimum": 0,
      "maximum": 9007199254740991
    },
    "pointsPerLevel": {
      "type": "integer",
      "minimum": 1,
      "maximum": 100
    },
    "experience": {
      "type": "object",
      "properties": {
        "base": {
          "type": "integer",
          "minimum": 1,
          "maximum": 100000
        },
        "perLevel": {
          "type": "integer",
          "minimum": 0,
          "maximum": 100000
        },
        "victoryPerEnemyLevel": {
          "type": "integer",
          "minimum": 0,
          "maximum": 100000
        },
        "perLevelSquared": {
          "type": "number",
          "minimum": 0,
          "maximum": 100000,
          "multipleOf": 1e-06
        }
      },
      "required": [
        "base",
        "perLevel",
        "perLevelSquared",
        "victoryPerEnemyLevel"
      ],
      "additionalProperties": false
    },
    "lifespan": {
      "type": "object",
      "properties": {
        "deathLoss": {
          "type": "integer",
          "minimum": 0,
          "maximum": 100000
        },
        "deployMinimum": {
          "type": "integer",
          "minimum": 0,
          "maximum": 100000
        },
        "restRecoveryPerStone": {
          "type": "integer",
          "minimum": 1,
          "maximum": 100000
        }
      },
      "required": [
        "deathLoss",
        "deployMinimum",
        "restRecoveryPerStone"
      ],
      "additionalProperties": false
    },
    "capture": {
      "type": "object",
      "properties": {
        "mpBase": {
          "type": "integer",
          "minimum": 0,
          "maximum": 100000
        },
        "mpPerCarryLevel": {
          "type": "number",
          "minimum": 0,
          "maximum": 100000,
          "multipleOf": 1e-06
        },
        "minChance": {
          "type": "number",
          "minimum": 0,
          "maximum": 1,
          "multipleOf": 1e-06
        },
        "maxChance": {
          "type": "number",
          "minimum": 0,
          "maximum": 1,
          "multipleOf": 1e-06
        },
        "baseChance": {
          "type": "number",
          "minimum": 0,
          "maximum": 1,
          "multipleOf": 1e-06
        },
        "missingHpFactor": {
          "type": "number",
          "minimum": 0,
          "maximum": 1,
          "multipleOf": 1e-06
        },
        "levelDifferenceFactor": {
          "type": "number",
          "minimum": 0,
          "maximum": 1,
          "multipleOf": 1e-06
        }
      },
      "required": [
        "mpBase",
        "mpPerCarryLevel",
        "minChance",
        "maxChance",
        "baseChance",
        "missingHpFactor",
        "levelDifferenceFactor"
      ],
      "additionalProperties": false
    },
    "panel": {
      "type": "object",
      "properties": {
        "naturalBase": {
          "type": "number",
          "minimum": 0,
          "maximum": 100000,
          "multipleOf": 1e-06
        },
        "naturalPerLevel": {
          "type": "number",
          "minimum": 0,
          "maximum": 100000,
          "multipleOf": 1e-06
        },
        "health": {
          "type": "object",
          "properties": {
            "aptitudeCoefficient": {
              "type": "number",
              "minimum": 0,
              "maximum": 100000,
              "multipleOf": 1e-06
            },
            "attributeCoefficient": {
              "type": "number",
              "minimum": 0,
              "maximum": 100000,
              "multipleOf": 1e-06
            }
          },
          "required": [
            "aptitudeCoefficient",
            "attributeCoefficient"
          ],
          "additionalProperties": false
        },
        "mana": {
          "type": "object",
          "properties": {
            "aptitudeCoefficient": {
              "type": "number",
              "minimum": 0,
              "maximum": 100000,
              "multipleOf": 1e-06
            },
            "attributeCoefficient": {
              "type": "number",
              "minimum": 0,
              "maximum": 100000,
              "multipleOf": 1e-06
            }
          },
          "required": [
            "aptitudeCoefficient",
            "attributeCoefficient"
          ],
          "additionalProperties": false
        },
        "physicalAtk": {
          "type": "object",
          "properties": {
            "aptitudeCoefficient": {
              "type": "number",
              "minimum": 0,
              "maximum": 100000,
              "multipleOf": 1e-06
            },
            "attributeCoefficient": {
              "type": "number",
              "minimum": 0,
              "maximum": 100000,
              "multipleOf": 1e-06
            }
          },
          "required": [
            "aptitudeCoefficient",
            "attributeCoefficient"
          ],
          "additionalProperties": false
        },
        "physicalDef": {
          "type": "object",
          "properties": {
            "aptitudeCoefficient": {
              "type": "number",
              "minimum": 0,
              "maximum": 100000,
              "multipleOf": 1e-06
            },
            "attributeCoefficient": {
              "type": "number",
              "minimum": 0,
              "maximum": 100000,
              "multipleOf": 1e-06
            }
          },
          "required": [
            "aptitudeCoefficient",
            "attributeCoefficient"
          ],
          "additionalProperties": false
        },
        "magicAtk": {
          "type": "object",
          "properties": {
            "aptitudeCoefficient": {
              "type": "number",
              "minimum": 0,
              "maximum": 100000,
              "multipleOf": 1e-06
            },
            "attributeCoefficient": {
              "type": "number",
              "minimum": 0,
              "maximum": 100000,
              "multipleOf": 1e-06
            }
          },
          "required": [
            "aptitudeCoefficient",
            "attributeCoefficient"
          ],
          "additionalProperties": false
        },
        "magicDef": {
          "type": "object",
          "properties": {
            "aptitudeCoefficient": {
              "type": "number",
              "minimum": 0,
              "maximum": 100000,
              "multipleOf": 1e-06
            },
            "attributeCoefficients": {
              "type": "object",
              "properties": {
                "constitution": {
                  "type": "number",
                  "minimum": 0,
                  "maximum": 100000,
                  "multipleOf": 1e-06
                },
                "magic": {
                  "type": "number",
                  "minimum": 0,
                  "maximum": 100000,
                  "multipleOf": 1e-06
                },
                "strength": {
                  "type": "number",
                  "minimum": 0,
                  "maximum": 100000,
                  "multipleOf": 1e-06
                },
                "endurance": {
                  "type": "number",
                  "minimum": 0,
                  "maximum": 100000,
                  "multipleOf": 1e-06
                }
              },
              "required": [
                "constitution",
                "magic",
                "strength",
                "endurance"
              ],
              "additionalProperties": false
            }
          },
          "required": [
            "aptitudeCoefficient",
            "attributeCoefficients"
          ],
          "additionalProperties": false
        },
        "speed": {
          "type": "object",
          "properties": {
            "aptitudeCoefficient": {
              "type": "number",
              "minimum": 0,
              "maximum": 100000,
              "multipleOf": 1e-06
            },
            "attributeCoefficient": {
              "type": "number",
              "minimum": 0,
              "maximum": 100000,
              "multipleOf": 1e-06
            }
          },
          "required": [
            "aptitudeCoefficient",
            "attributeCoefficient"
          ],
          "additionalProperties": false
        }
      },
      "required": [
        "naturalBase",
        "naturalPerLevel",
        "health",
        "mana",
        "physicalAtk",
        "physicalDef",
        "magicAtk",
        "magicDef",
        "speed"
      ],
      "additionalProperties": false
    }
  },
  "required": [
    "formatVersion",
    "contentRevision",
    "pointsPerLevel",
    "experience",
    "lifespan",
    "capture",
    "panel"
  ],
  "additionalProperties": false
}
