{
  "$schema": "./progression.schema.json",
  "formatVersion": 1,
  "contentRevision": 3,
  "pointsPerLevel": 5,
  "experience": {
    "base": 100,
    "perLevel": 20,
    "victoryPerEnemyLevel": 10,
    "perLevelSquared": 0.5
  },
  "lifespan": {
    "deathLoss": 50,
    "deployMinimum": 50,
    "restRecoveryPerStone": 10
  },
  "capture": {
    "mpBase": 10,
    "mpPerCarryLevel": 1,
    "minChance": 0.1,
    "maxChance": 0.85,
    "baseChance": 0.35,
    "missingHpFactor": 0.4,
    "levelDifferenceFactor": 0.01
  },
  "panel": {
    "naturalBase": 10,
    "naturalPerLevel": 1,
    "health": {
      "aptitudeCoefficient": 0.002895,
      "attributeCoefficient": 7
    },
    "mana": {
      "aptitudeCoefficient": 0.002085,
      "attributeCoefficient": 5
    },
    "physicalAtk": {
      "aptitudeCoefficient": 0.0025,
      "attributeCoefficient": 1.6
    },
    "physicalDef": {
      "aptitudeCoefficient": 0.003345,
      "attributeCoefficient": 2.4
    },
    "magicAtk": {
      "aptitudeCoefficient": 0.000845,
      "attributeCoefficient": 1.3
    },
    "speed": {
      "aptitudeCoefficient": 0.002087,
      "attributeCoefficient": 1.6
    },
    "magicDef": {
      "aptitudeCoefficient": 0.000611,
      "attributeCoefficients": {
        "constitution": 0.3,
        "magic": 0.8,
        "strength": 0.48,
        "endurance": 0.16
      }
    }
  }
}
